,Review,Review_only_text,neg,pos,neu,compound,Negative,Positive
131,"Bought this for my beer brewing.  Haven't gotten my chest freezer or extra fridge yet to try out the temp regulating, so right now it's just an expensive digital thermometer but it works great!  Had it hooked up into the brew pot and was able to control the temp of my boil the entire time.  Will update the review once I try it out with my chest freezer.",Bought this for my beer brewing Haven t gotten my chest freezer or extra fridge yet to try out the temp regulating so right now it s just an expensive digital thermometer but it works great Had it hooked up into the brew pot and was able to control the temp of my boil the entire time Will update the review once I try it out with my chest freezer,0.0,0.083,0.917,0.7871,False,True
132,This product has been amazing for helping to maintain a constant temperature in a homemade jacketed fermenter that I made for lagering or just keeping an eye on the temperature during the warm summer months.,This product has been amazing for helping to maintain a constant temperature in a homemade jacketed fermenter that I made for lagering or just keeping an eye on the temperature during the warm summer months,0.0,0.214,0.786,0.7845,False,True
133,This product works great. We bought it to help control the temperature inside of our beer meister to help prevent frozen kegs. It was easy to install and easy to setup the settings. The best part is it keeps the beer ice cold.,This product works great We bought it to help control the temperature inside of our beer meister to help prevent frozen kegs It was easy to install and easy to setup the settings The best part is it keeps the beer ice cold,0.0,0.364,0.636,0.9618,False,True
134,"I use this JC D-Therm to control my kegorator.  It is an indispensable upgrade over the cheap-Charlie, useless piece of #$!@ that came stock on the refrigerator.  I would recommend this controller for any refrigeration control task.  Easy aftermarket install.",I use this JC D Therm to control my kegorator It is an indispensable upgrade over the cheap Charlie useless piece of that came stock on the refrigerator I would recommend this controller for any refrigeration control task Easy aftermarket install,0.064,0.131,0.805,0.4389,False,True
135,I needed a device to keep room temp around 80 degrees F. This runs my electric heaters without having the room too hot or cold. If the electric turns off and on it does not change settings! Very nice.,I needed a device to keep room temp around degrees F This runs my electric heaters without having the room too hot or cold If the electric turns off and on it does not change settings Very nice,0.0,0.086,0.914,0.5244,False,True
136,"Works perfectly.  Has a number of options for dialing in on exactly the right temperature.  I use this to control fermentation temperatures for beer.  I just fold up a towel and secure it to the bucket or carboy with a big rubber band, and tuck the temperature probe between the fermenter and towel.",Works perfectly Has a number of options for dialing in on exactly the right temperature I use this to control fermentation temperatures for beer I just fold up a towel and secure it to the bucket or carboy with a big rubber band and tuck the temperature probe between the fermenter and towel,0.0,0.149,0.851,0.7845,False,True
137,This product works perfect for controlling the temperature in my beer cellar.,This product works perfect for controlling the temperature in my beer cellar,0.0,0.252,0.748,0.5719,False,True
138,"Especially, KOREAN Kochi refrigerator, all you need this temp control and economic  freezer to set up year round temperature 33 F.",Especially KOREAN Kochi refrigerator all you need this temp control and economic freezer to set up year round temperature F,0.0,0.0,1.0,0.0,False,False
139,"I haven't heard any complaints from my Husband, so it must work as expected. He has his first batch of beer in the freezer using this thermostat so we will find out soon how happy he is with it. I priced this item at a few different places and this was the best price I could find.",I haven t heard any complaints from my Husband so it must work as expected He has his first batch of beer in the freezer using this thermostat so we will find out soon how happy he is with it I priced this item at a few different places and this was the best price I could find,0.0,0.169,0.831,0.8795,False,True
140,"Very easy to install, and so far it works perfectly. I use it for a Kegerator to keep the temp between 35-39 degrees and this works like a charm. As long as it keep on working i will recommend this product all day.",Very easy to install and so far it works perfectly I use it for a Kegerator to keep the temp between degrees and this works like a charm As long as it keep on working i will recommend this product all day,0.0,0.307,0.693,0.9336,False,True
141,"Nice reliable product.  I currently use it on an old wine fridge as a homebrew fermentation chamber.  It had a bad thermostat and I already had this controller.  Holds the perfect temp, especially brewing in the summer.",Nice reliable product I currently use it on an old wine fridge as a homebrew fermentation chamber It had a bad thermostat and I already had this controller Holds the perfect temp especially brewing in the summer,0.087,0.163,0.75,0.4588,False,True
142,Wow so far so good. This thing is accurate to ~1 degree or so. You can set the difference of the set point you to when the heater comes on to whatever interval you want. I am using this for an aquarium with a finnex th heater.,Wow so far so good This thing is accurate to degree or so You can set the difference of the set point you to when the heater comes on to whatever interval you want I am using this for an aquarium with a finnex th heater,0.0,0.179,0.821,0.847,False,True
143,"I was having wide temperature swings with my kegerator, making it impossible to control foam. This maintains the perfect temperature. Plug the kegerator into this control unit and turn the kegerator's temperature control to the coldest setting.",I was having wide temperature swings with my kegerator making it impossible to control foam This maintains the perfect temperature Plug the kegerator into this control unit and turn the kegerator s temperature control to the coldest setting,0.0,0.096,0.904,0.5719,False,True
144,"Very easy to use once you understand the different codes. Just plugged in my refrigerator and attached the thermostat to the carboy with tape and insulation. Set the temperature along with the offset and it worked perfectly. Very easy to change temperature, if necessary.",Very easy to use once you understand the different codes Just plugged in my refrigerator and attached the thermostat to the carboy with tape and insulation Set the temperature along with the offset and it worked perfectly Very easy to change temperature if necessary,0.0,0.205,0.795,0.8906,False,True
145,"I use this when lower fermentation temps are required for my home brew.Just drill a hold in the back of a fridge or freezer, insert probe, piggyback electrical chord to the thermostat and you are ready to go.simple and effective.",I use this when lower fermentation temps are required for my home brew Just drill a hold in the back of a fridge or freezer insert probe piggyback electrical chord to the thermostat and you are ready to go simple and effective,0.053,0.134,0.813,0.5267,False,True
146,"Its been running for over a month so,  so far so good.  It holds its temp but has to be set lower than the desired temp.  a thermometer in the freezer is a must for accurate settings",Its been running for over a month so so far so good It holds its temp but has to be set lower than the desired temp a thermometer in the freezer is a must for accurate settings,0.072,0.133,0.795,0.3368,False,True
147,Keeps my kegerator beer cooler...,Keeps my kegerator beer cooler,0.0,0.0,1.0,0.0,False,False
148,I am satisfied with good products,I am satisfied with good products,0.0,0.655,0.345,0.6908,False,True
149,"converted a 13cu ft freezer into a cornie keg cooler and couldn't be happier. been chillin up to five pinners of homebrews with room to spare for a co2 tank, hops, yeast and bottles - makes lagering a piece of cake. very consistent and easy to use.",converted a cu ft freezer into a cornie keg cooler and couldn t be happier been chillin up to five pinners of homebrews with room to spare for a co tank hops yeast and bottles makes lagering a piece of cake very consistent and easy to use,0.06,0.069,0.871,0.0996,False,False
150,You can do so many different things with this. I love it,You can do so many different things with this I love it,0.0,0.333,0.667,0.7184,False,True
151,The Johnsons Digital Control Unit did exactly what it I bought it for!It controls the temperature on my fermenting sausage refrigerator within 4 degrees.Very easy to operate and solidly built..I recommend!,The Johnsons Digital Control Unit did exactly what it I bought it for It controls the temperature on my fermenting sausage refrigerator within degrees Very easy to operate and solidly built I recommend,0.0,0.181,0.819,0.717,False,True
152,"Works great! The unit worked flawlessly and the instructions were clear. The options were numerous - heating, cooling, set points, failure modes - LOVE IT! We have already successfully used it a couple of time for curing resins. Be sure to buy some thermally conductive compound to use between the probe and the surface you're measuring.",Works great The unit worked flawlessly and the instructions were clear The options were numerous heating cooling set points failure modes LOVE IT We have already successfully used it a couple of time for curing resins Be sure to buy some thermally conductive compound to use between the probe and the surface you re measuring,0.048,0.284,0.668,0.9452,False,True
153,money saver for malfunctioning fridges or re-purposing freezers for fridges or kegerators!  also use them to control cheap electrical heaters that have no thermostat.,money saver for malfunctioning fridges or re purposing freezers for fridges or kegerators also use them to control cheap electrical heaters that have no thermostat,0.14,0.0,0.86,-0.3802,True,False
154,Has worked well for me for the last 3 years.  Can't complain,Has worked well for me for the last years Can t complain,0.0,0.319,0.681,0.4956,False,True
155,"I've had this thing working on my kegerator for years now and I've never had any problems with it.  It's solid and works exactly as advertised.  I do wish it was a bit cheaper, but the quality is certainly there.",I ve had this thing working on my kegerator for years now and I ve never had any problems with it It s solid and works exactly as advertised I do wish it was a bit cheaper but the quality is certainly there,0.0,0.188,0.812,0.7077,False,True
156,This temp controller works well and is fairly simple to use. I'm using it to control fermentation temp on a minifridge and it's doing a great job. Digital readout is accurate (compared to thermometers inside the fridge) and easy to use after a quick read of the instruction manual. My beers have been turning out better. Includes an adjustable cycle timeout for older fridges and an adjustable +/- variation limit.Great addition to a homebrewers' arsenal.,This temp controller works well and is fairly simple to use I m using it to control fermentation temp on a minifridge and it s doing a great job Digital readout is accurate compared to thermometers inside the fridge and easy to use after a quick read of the instruction manual My beers have been turning out better Includes an adjustable cycle timeout for older fridges and an adjustable variation limit Great addition to a homebrewers arsenal,0.0,0.152,0.848,0.9001,False,True
157,"After a failed attempt at getting it to control my little brewing ""freezer"",  I decided to read the directions!  Aha!  There's instructions as to how to set the pins inside the thermostat so that it cools down to 34F, but stops there and not get any colder.  Works like a charm.",After a failed attempt at getting it to control my little brewing freezer I decided to read the directions Aha There s instructions as to how to set the pins inside the thermostat so that it cools down to F but stops there and not get any colder Works like a charm,0.073,0.133,0.794,0.6524,False,True
158,"I bought this to keep tighter control on my keezer (Google it if you don't know).  The directions seem to be written for an HVAC professional (and/or I'm just dense, which is entirely possible), but it's keeping my beer nice and frosty cold.",I bought this to keep tighter control on my keezer Google it if you don t know The directions seem to be written for an HVAC professional and or I m just dense which is entirely possible but it s keeping my beer nice and frosty cold,0.0,0.083,0.917,0.5719,False,True
159,great product,great product,0.0,0.804,0.196,0.6249,False,True
160,"Hope it works well, the instructions are far more involved than they should be for a thermostat.I need this thing but it is a pain in the butt to set up.",Hope it works well the instructions are far more involved than they should be for a thermostat I need this thing but it is a pain in the butt to set up,0.131,0.103,0.766,-0.4497,True,False
161,"my kegerator was fluctuating in temp, so i put its thermostat on max setup this digital  thermostat now the temp is so stable.very happy with it!",my kegerator was fluctuating in temp so i put its thermostat on max setup this digital thermostat now the temp is so stable very happy with it,0.0,0.151,0.849,0.6452,False,True
162,The control is easy to install and operate.  I now have a great cheese cave for my homemade cheeses.  Keep in mind it will also affect the freezer portion of your refrigerator unit.,The control is easy to install and operate I now have a great cheese cave for my homemade cheeses Keep in mind it will also affect the freezer portion of your refrigerator unit,0.0,0.194,0.806,0.7906,False,True
163,"This is a product that does just what it says with a fair amount of ease of operation.Read the directions, I had a friend in electronics help which just made the programing go faster but you can do it if your not an electrition.",This is a product that does just what it says with a fair amount of ease of operation Read the directions I had a friend in electronics help which just made the programing go faster but you can do it if your not an electrition,0.0,0.17,0.83,0.6542,False,True
164,I bought this for a chest freezer that I turned into a kegerator. It's plug and play. I used a 5 gal bucket of water to check for liquid temps. The liquid temps are lower than the air temps. This thermostat reads air temps.,I bought this for a chest freezer that I turned into a kegerator It s plug and play I used a gal bucket of water to check for liquid temps The liquid temps are lower than the air temps This thermostat reads air temps,0.056,0.061,0.884,0.0516,False,False
165,we bought this product to control the temp. in our 37 cubic foot smoker (a sub zero freezer with the parts removed). we followed the instructions and in 5 minutes we were good to go.  It was plugged in to a 1500 watt heat element and cycled very smoothly all day and held the temp within the set variance. If you need one that will hold more amps you will have to step up to the hard wire version.  we are ordering another one for a second heating element.  great product and very portable,we bought this product to control the temp in our cubic foot smoker a sub zero freezer with the parts removed we followed the instructions and in minutes we were good to go It was plugged in to a watt heat element and cycled very smoothly all day and held the temp within the set variance If you need one that will hold more amps you will have to step up to the hard wire version we are ordering another one for a second heating element great product and very portable,0.015,0.073,0.913,0.765,False,True
166,Seems to be of good quality. Someday I hope to figure out how to operate it.,Seems to be of good quality Someday I hope to figure out how to operate it,0.0,0.309,0.691,0.7003,False,True
167,This thing rocks. Easy to use and configure.  Keeps my beer right at 33 degrees,This thing rocks Easy to use and configure Keeps my beer right at degrees,0.0,0.172,0.828,0.4404,False,True
168,"It is easy to set up and use as stated....the cool thing is once its dialed in you can unplug it, and that fridge goes back to normal ,and with out any more adjustments you can plug it in to another and it works great as is. I use it for fermenting, and love it.",It is easy to set up and use as stated the cool thing is once its dialed in you can unplug it and that fridge goes back to normal and with out any more adjustments you can plug it in to another and it works great as is I use it for fermenting and love it,0.0,0.213,0.787,0.926,False,True
169,"Been using these with my reptiles for many years, never had one break or malfunction.",Been using these with my reptiles for many years never had one break or malfunction,0.0,0.0,1.0,0.0,False,False
170,When we upgraded our freezer I used this temp control to convert it to a fermentation chamber. Then when I want to cold crash the beer or wine I just lower the temp for a couple of days.  Need to get a second one and build my kegerator.,When we upgraded our freezer I used this temp control to convert it to a fermentation chamber Then when I want to cold crash the beer or wine I just lower the temp for a couple of days Need to get a second one and build my kegerator,0.108,0.029,0.863,-0.5574,True,False
171,"First unit I received died within a week; it stopped sending power to the freezer. Thanks to the excellent customer service from The Beverage Factory, I was sent another unit free of charge. This unit has been working ever since without issue. I find this item very user friendly for making a home fermentation chamber out of an old freezer. It also seems durable, despite my problems with the first one.",First unit I received died within a week it stopped sending power to the freezer Thanks to the excellent customer service from The Beverage Factory I was sent another unit free of charge This unit has been working ever since without issue I find this item very user friendly for making a home fermentation chamber out of an old freezer It also seems durable despite my problems with the first one,0.069,0.195,0.736,0.8789,False,True
172,"the cheapest reliable temperature controller i'd seen on amazon when i bought it. it can be a little inaccurate at times by 1-3 degrees, but for the most part works well.",the cheapest reliable temperature controller i d seen on amazon when i bought it it can be a little inaccurate at times by degrees but for the most part works well,0.0,0.14,0.86,0.526,False,True
173,I'm using this controller to set the temperatures in a fridge I use as a fermentation chamber for brewing. Works great! You can set it to a target temperature and adjust how much of a range is allowed above and below your target.,I m using this controller to set the temperatures in a fridge I use as a fermentation chamber for brewing Works great You can set it to a target temperature and adjust how much of a range is allowed above and below your target,0.0,0.106,0.894,0.6588,False,True
174,"I used mine to turn a chest freezer into a refrigerator. When you open a standard refrigerator the cold air literally falls to the floor and thus the refrigerator cycles much more often.  When you open a box or chest freezer (which is usually better insulated) most of the cold air stays in the bottom of the box when you open it instead of it escaping from the bottom, like your fridge. Many people use this conversion as an energy saving device and all it takes is pluging it in and setting the temp to somewhere above freezing. I've heard it said you can save 70-90% of energy consumption using this configuration, so if you are off the grid, it might really pay off for you. However, it is more difficult to arrange and stack your cold items for rotation and easy access. Hope this helps.",I used mine to turn a chest freezer into a refrigerator When you open a standard refrigerator the cold air literally falls to the floor and thus the refrigerator cycles much more often When you open a box or chest freezer which is usually better insulated most of the cold air stays in the bottom of the box when you open it instead of it escaping from the bottom like your fridge Many people use this conversion as an energy saving device and all it takes is pluging it in and setting the temp to somewhere above freezing I ve heard it said you can save of energy consumption using this configuration so if you are off the grid it might really pay off for you However it is more difficult to arrange and stack your cold items for rotation and easy access Hope this helps,0.037,0.145,0.818,0.9424,False,True
175,"Two year's worth of service without a hiccup, and still going strong!  Easy to set up.  I use mine to control the temp in my kegerator which I built from a chest freezer.  I've also used it to maintain lagering temp.  Go for the digital model - you won't be sorry.",Two year s worth of service without a hiccup and still going strong Easy to set up I use mine to control the temp in my kegerator which I built from a chest freezer I ve also used it to maintain lagering temp Go for the digital model you won t be sorry,0.0,0.186,0.814,0.8231,False,True
176,"have 2 of these on line, one for a kegurator, the other i use to control fermentation for home brewing beers.easy to set up and adjust temp as needed.  hot or cold control.",have of these on line one for a kegurator the other i use to control fermentation for home brewing beers easy to set up and adjust temp as needed hot or cold control,0.0,0.0,1.0,0.0,False,False
177,Worked beyond my expectations. It actually stays exactly at the right temp. I am using it to ferment beer. It is in my mini fridge. I am using it with a Mr. Beer kit. We left the house for ten days ant it got to the 90's in the house while we were gone. The mini fridge stayed at 72 degrees the entire time. I will see what the beer tastes like in a week. That will be the real test.,Worked beyond my expectations It actually stays exactly at the right temp I am using it to ferment beer It is in my mini fridge I am using it with a Mr Beer kit We left the house for ten days ant it got to the s in the house while we were gone The mini fridge stayed at degrees the entire time I will see what the beer tastes like in a week That will be the real test,0.0,0.032,0.968,0.3612,False,True
178,I love this product. Bought a $300 freezer and turned it into a wine fridge. Easy to install and operate. Calling them for tech support is practically impossible.,I love this product Bought a freezer and turned it into a wine fridge Easy to install and operate Calling them for tech support is practically impossible,0.0,0.308,0.692,0.8689,False,True
179,Works great on my upright freezer that I use to cellar beer.,Works great on my upright freezer that I use to cellar beer,0.0,0.291,0.709,0.6249,False,True
180,"Great brand new control unit, and easy installation.  It is the perfect solution for the homebrewer for lagering or consistent low-temperature carbonation without the risk of freezing.  Just a suggestion - the factory default setting is +/- 7 degrees F.  Change this to +/- 2 or so for a more stable environment.",Great brand new control unit and easy installation It is the perfect solution for the homebrewer for lagering or consistent low temperature carbonation without the risk of freezing Just a suggestion the factory default setting is degrees F Change this to or so for a more stable environment,0.024,0.298,0.678,0.9448,False,True
181,used it to hack a sous-vide cooker out of a crockpot. Works great!,used it to hack a sous vide cooker out of a crockpot Works great,0.0,0.305,0.695,0.6588,False,True
182,"We use this to regulate a bread proofing box""s temperature.  It works great.  We live in Oregon on the coast where it is colder and really need it.  My wife makes artisan breads and feels much more secure using this controller in the proofing box.",We use this to regulate a bread proofing box s temperature It works great We live in Oregon on the coast where it is colder and really need it My wife makes artisan breads and feels much more secure using this controller in the proofing box,0.0,0.139,0.861,0.7778,False,True
183,"Used this product to keep a chest freezer right around 29 degrees and created a keezer (freezer kegerator) out of it, does the job well and can limit cycles to keep the freezer running for a long time.",Used this product to keep a chest freezer right around degrees and created a keezer freezer kegerator out of it does the job well and can limit cycles to keep the freezer running for a long time,0.0,0.111,0.889,0.4767,False,True
184,Works exactly as it is supposed to. just like some others have said directions can be confusing. there is a review by claws dat scratch that is very helpful with understanding the setup. if you need some help with setup check out their review.http://www.amazon.com/review/RCZQX32L8IW6U/ref=cm_cr_dp_cmt?ie=UTF8&ASIN=B00368D6JA&nodeID=228013&store=hi#wasThisHelpful,Works exactly as it is supposed to just like some others have said directions can be confusing there is a review by claws dat scratch that is very helpful with understanding the setup if you need some help with setup check out their review http www amazon com review RCZQX L IW U ref cm_cr_dp_cmt ie UTF ASIN B D JA nodeID store hi wasThisHelpful,0.039,0.169,0.793,0.7501,False,True
