,Review,Review_only_text,neg,pos,neu,compound,Negative,Positive
367,"Koreans usually contain our Kimchi in a Kimchi freezer that can maintain 0 degree Celcius (32 degrees Fahrenheit) accurately. Not only Kimchi but most vegetables and fruits are fresher in a Kimchi freezer than in a rough ordinary refrigerator that can only maintain temperatures in several degrees of wide range. Korean ancestors digged a ground hole and contained Kimchi there along the winter. Generally genuine Kimchi freezers have very accurate temperature controls but very expensive because of their unique freezing apparatus.One of Korean engineer in US (I can't remember him now, except he wrote his work in the missyusa website) made an idea that this Johnson Control Unit could be combined with a chest freezer to make a Kimchi freezer in a reasonable price. I made my own Kimchi freezer with Danby DCF700W1 7.0 cu. ft. Chest Freezer. Then I set the Johnson Control's target temperature to 34F, and squeeze the control range to just 1 degree. The Thermo-couple (temperature detector tip) is floated in the air of the center of the freezer. The machine's operating rule is very simple. Cooler than target temperature, switch off. Warmer than target temperature, swith on. All automatically.The result is awesome. The air temperature at the center of the freezer easily maintained from 29F to 34F. Womderful!p.s. However, I changed the setting to 36F to contain vegetables :)",Koreans usually contain our Kimchi in a Kimchi freezer that can maintain degree Celcius degrees Fahrenheit accurately Not only Kimchi but most vegetables and fruits are fresher in a Kimchi freezer than in a rough ordinary refrigerator that can only maintain temperatures in several degrees of wide range Korean ancestors digged a ground hole and contained Kimchi there along the winter Generally genuine Kimchi freezers have very accurate temperature controls but very expensive because of their unique freezing apparatus One of Korean engineer in US I can t remember him now except he wrote his work in the missyusa website made an idea that this Johnson Control Unit could be combined with a chest freezer to make a Kimchi freezer in a reasonable price I made my own Kimchi freezer with Danby DCF W cu ft Chest Freezer Then I set the Johnson Control s target temperature to F and squeeze the control range to just degree The Thermo couple temperature detector tip is floated in the air of the center of the freezer The machine s operating rule is very simple Cooler than target temperature switch off Warmer than target temperature swith on All automatically The result is awesome The air temperature at the center of the freezer easily maintained from F to F Womderful p s However I changed the setting to F to contain vegetables,0.012,0.071,0.917,0.9441,False,True
368,"I'm using this with my keg fridge that had a very poor temp control in it.  This is much better.Very easy to use and the setup.  The configurable deadband and min off times are very nice.I now have my beer at 0 to 1 degree without freezing, very very nice!",I m using this with my keg fridge that had a very poor temp control in it This is much better Very easy to use and the setup The configurable deadband and min off times are very nice I now have my beer at to degree without freezing very very nice,0.063,0.145,0.793,0.5371,False,True
369,"This controller is already wired, so all you have to do is plug it in and set your temperature through the digital display.",This controller is already wired so all you have to do is plug it in and set your temperature through the digital display,0.0,0.0,1.0,0.0,False,False
370,"Works perfectly out of the box. Easy to use, good instructions",Works perfectly out of the box Easy to use good instructions,0.0,0.556,0.444,0.875,False,True
371,"Working great so far, let's hope it lasts a long time!",Working great so far let s hope it lasts a long time,0.0,0.486,0.514,0.8203,False,True
372,"I chose this unit as I had seen it in action from other home brewers. It is simple to install, easy to set and is pretty much plug and play. It controls my 'Keezer' perfectly, and I never have to worry about temperature fluctuation. I will be buying another for my refrigerator so I can control it better as well. THIS UNIT IS AN ABSOLUTE MUST FOR HOMEBREWERS",I chose this unit as I had seen it in action from other home brewers It is simple to install easy to set and is pretty much plug and play It controls my Keezer perfectly and I never have to worry about temperature fluctuation I will be buying another for my refrigerator so I can control it better as well THIS UNIT IS AN ABSOLUTE MUST FOR HOMEBREWERS,0.0,0.264,0.736,0.959,False,True
373,"This device, the Johnson Controls Digital Thermostat Control Unit, performs exactly as specified. If you need something like this device, this is the one to get.",This device the Johnson Controls Digital Thermostat Control Unit performs exactly as specified If you need something like this device this is the one to get,0.0,0.091,0.909,0.3612,False,True
374,"Ordered the A419, got the A421.  Giving it a try anyway.",Ordered the A got the A Giving it a try anyway,0.0,0.211,0.789,0.34,False,True
375,So far so good.  Does what it's supposed to do and seems well built.  My only mild complaints are that it seems a bit expensive and the directions are not as clearly written as they should be.,So far so good Does what it s supposed to do and seems well built My only mild complaints are that it seems a bit expensive and the directions are not as clearly written as they should be,0.115,0.143,0.742,0.2989,False,True
376,This item did not work right out of the box. I have had a blue box Johnson Controls and it has worked for me for years. Spend the extra few bucks on that one.,This item did not work right out of the box I have had a blue box Johnson Controls and it has worked for me for years Spend the extra few bucks on that one,0.0,0.0,1.0,0.0,False,False
377,"Great digital control, ought it so I am better able to have my homebrew fermenting at the proper temp.,loving it.",Great digital control ought it so I am better able to have my homebrew fermenting at the proper temp loving it,0.0,0.3,0.7,0.8062,False,True
378,It works perfect.,It works perfect,0.0,0.649,0.351,0.5719,False,True
379,Easy to use and set up. Exactly what is needed for keeping a freezer at temperatures as desired. Slightly bulky. But otherwise perfect.,Easy to use and set up Exactly what is needed for keeping a freezer at temperatures as desired Slightly bulky But otherwise perfect,0.0,0.31,0.69,0.8201,False,True
380,Bought this to accurately control the temp of my 5 cu ft chest freezer for home brewing lagers and Alt beers.Love it.,Bought this to accurately control the temp of my cu ft chest freezer for home brewing lagers and Alt beers Love it,0.0,0.0,1.0,0.0,False,False
381,This little unit does exactly what I needed.I use this for climate control in a small area.It works great. Instructions are easy and accurate.,This little unit does exactly what I needed I use this for climate control in a small area It works great Instructions are easy and accurate,0.0,0.259,0.741,0.7906,False,True
382,"I have been using these in regulating temperature for my snakes for last few years, combine these with a radiant heat panel and I have had much success so far I have had 3 going for a year with no issues and will be getting a 4th.",I have been using these in regulating temperature for my snakes for last few years combine these with a radiant heat panel and I have had much success so far I have had going for a year with no issues and will be getting a th,0.048,0.148,0.804,0.6808,False,True
383,"If you are a home brewer wanting to keep a chest freezer at the right temp to brew beer, this unit is for you.  No alterations to the freezer are required.  Plug the freezer to the temp controller, plug in the controller, press set set arrow up or down to temp desired, press set and you are done!  VERY simple!",If you are a home brewer wanting to keep a chest freezer at the right temp to brew beer this unit is for you No alterations to the freezer are required Plug the freezer to the temp controller plug in the controller press set set arrow up or down to temp desired press set and you are done VERY simple,0.046,0.034,0.92,-0.1739,True,False
384,Exquisite for homebrew purposes!,Exquisite for homebrew purposes,0.0,0.0,1.0,0.0,False,False
385,MUCH BETTER THAN EXPECTED FOR MY USE.,MUCH BETTER THAN EXPECTED FOR MY USE,0.0,0.326,0.674,0.4404,False,True
386,good product,good product,0.0,0.744,0.256,0.4404,False,True
387,nice working !!!,nice working,0.0,0.648,0.352,0.5684,False,True
388,"I recommend this for the homebrewer who is looking to brew lagers, as is will more accurately control the temperature of your refrigerator/chest freezer.",I recommend this for the homebrewer who is looking to brew lagers as is will more accurately control the temperature of your refrigerator chest freezer,0.0,0.102,0.898,0.3612,False,True
389,Works great for my kegerator.,Works great for my kegerator,0.0,0.506,0.494,0.6249,False,True
390,Works great.  If you need a controller that is temperature controlled this does the job.  Easy to operate and set.,Works great If you need a controller that is temperature controlled this does the job Easy to operate and set,0.0,0.292,0.708,0.7906,False,True
391,"I initially thought I was going to need to wire it into the power cord on my freeze myself, but it was actually a simple plug and play. Easy to follow directions for setting your control settings made it that much easier. I couldn't be happier.",I initially thought I was going to need to wire it into the power cord on my freeze myself but it was actually a simple plug and play Easy to follow directions for setting your control settings made it that much easier I couldn t be happier,0.07,0.224,0.706,0.7956,False,True
392,"Excellent device, simple to use, does what it says on the box, just plug and play.  Perfect for controlling freezers for fermenting and largering",Excellent device simple to use does what it says on the box just plug and play Perfect for controlling freezers for fermenting and largering,0.036,0.317,0.647,0.8658,False,True
393,This controller is hooked up to my mini-fridge for lagering  my beer.  Works well.  I would like to see the manual written with more user friendly language.,This controller is hooked up to my mini fridge for lagering my beer Works well I would like to see the manual written with more user friendly language,0.0,0.26,0.74,0.7951,False,True
394,"Plugged it into to a cheap 5 cubic ft freezer to keep keg/fermenter at optimal temperature.  Very easy to use digital interface, no need to wire anything manually.",Plugged it into to a cheap cubic ft freezer to keep keg fermenter at optimal temperature Very easy to use digital interface no need to wire anything manually,0.071,0.184,0.745,0.5413,False,True
395,Directions are complicated,Directions are complicated,0.0,0.0,1.0,0.0,False,False
396,Used this device to build a home made kegerator and it works very well. Will buy another when I finally put my lagering system together.,Used this device to build a home made kegerator and it works very well Will buy another when I finally put my lagering system together,0.0,0.098,0.902,0.3384,False,True
397,Works great,Works great,0.0,0.804,0.196,0.6249,False,True
398,Great quality.  This is easy to set up and can very accurately hold my fermentation temps within 1-2 degrees.  Will do heating mode or cooling mode.,Great quality This is easy to set up and can very accurately hold my fermentation temps within degrees Will do heating mode or cooling mode,0.0,0.226,0.774,0.7906,False,True
399,I use this weekly with a cheap slow cooker/croc pot. It keeps temperature very well and the probe is easy to place.,I use this weekly with a cheap slow cooker croc pot It keeps temperature very well and the probe is easy to place,0.0,0.227,0.773,0.6478,False,True
400,Have been using this for over a year now and it still works great. It was a little hard to figure out the programming but it does it's job.,Have been using this for over a year now and it still works great It was a little hard to figure out the programming but it does it s job,0.037,0.089,0.874,0.3604,False,True
401,one for fermentation and one for your keezer. this thing rocks and this was the lowest price on the net.,one for fermentation and one for your keezer this thing rocks and this was the lowest price on the net,0.12,0.0,0.88,-0.3818,True,False
402,I bought this controller to convert my chest freezer to a keezer for my kegged home brewed beer. It was easy to understand the instructions and program for the ideal temperature I needed for an optimum pore! I plan to order another in the future to control my fermentation chamber .,I bought this controller to convert my chest freezer to a keezer for my kegged home brewed beer It was easy to understand the instructions and program for the ideal temperature I needed for an optimum pore I plan to order another in the future to control my fermentation chamber,0.0,0.13,0.87,0.7644,False,True
403,best I've found for the money,best I ve found for the money,0.0,0.457,0.543,0.6369,False,True
404,"HAVE ONLY HAD THE ITEM FOR A FEW WEEKS, BUT IT WORKS WELL AS DESCRIBED.",HAVE ONLY HAD THE ITEM FOR A FEW WEEKS BUT IT WORKS WELL AS DESCRIBED,0.0,0.169,0.831,0.3919,False,True
405,Works.  Easy to setup if you're using for controlling cooling.,Works Easy to setup if you re using for controlling cooling,0.0,0.244,0.756,0.4404,False,True
406,"Got this for my Keezer build. ""Plug and play"", just as I was hoping! Since installation temps have been consistent. Will be getting another for fermentation controll.",Got this for my Keezer build Plug and play just as I was hoping Since installation temps have been consistent Will be getting another for fermentation controll,0.0,0.11,0.89,0.4753,False,True
407,"I purchased this control to regulate the temperature in my old refrigerator that I wanted to cure meat in. So far, I have used it fora couple of weeks and it is doing the job! It is very easy to set up and it does keep the temperature where I have programmed it.",I purchased this control to regulate the temperature in my old refrigerator that I wanted to cure meat in So far I have used it fora couple of weeks and it is doing the job It is very easy to set up and it does keep the temperature where I have programmed it,0.0,0.068,0.932,0.54,False,True
408,"Works great to keep my lager at stable temperatures.  I checked it regularly for the first three weeks of owning this product and have never seen it different than 54 degrees (I set it at 55 degrees).Excellent for use with a freezer chest for lagering and storing kegs. Definitely recommended.  I have not drilled a hole in my freezer chest yet, so I close the lid on the probe, which crimps the cord a little bit, but works just fine for my purposes.",Works great to keep my lager at stable temperatures I checked it regularly for the first three weeks of owning this product and have never seen it different than degrees I set it at degrees Excellent for use with a freezer chest for lagering and storing kegs Definitely recommended I have not drilled a hole in my freezer chest yet so I close the lid on the probe which crimps the cord a little bit but works just fine for my purposes,0.0,0.118,0.882,0.765,False,True
409,"Easy to set up, controlled my heating system to within +/- 2 F.",Easy to set up controlled my heating system to within F,0.0,0.209,0.791,0.4404,False,True
410,works great on my Keezer.  its keeping my beer at 30 degrees..,works great on my Keezer its keeping my beer at degrees,0.0,0.272,0.728,0.6249,False,True
411,"I bought this device to override the thermostat in a wine fridge that I use as a beer fermentation chamber.  The fridge has analog controls that are not precise.  This product was easy to set up using the included instructions, and has so far worked like a champ.",I bought this device to override the thermostat in a wine fridge that I use as a beer fermentation chamber The fridge has analog controls that are not precise This product was easy to set up using the included instructions and has so far worked like a champ,0.0,0.18,0.82,0.83,False,True
412,Great price works as advertised.,Great price works as advertised,0.0,0.506,0.494,0.6249,False,True
413,"works great and easy to use. definitely worth the extra $20 or so to upgrade from the analog/dial version. This is much more accurate. The other version works good enough though, you just need a thermometer to double check everything.",works great and easy to use definitely worth the extra or so to upgrade from the analog dial version This is much more accurate The other version works good enough though you just need a thermometer to double check everything,0.0,0.299,0.701,0.926,False,True
414,Great for my kegerator.,Great for my kegerator,0.0,0.577,0.423,0.6249,False,True
415,Unit works great. Using it to ferment ale in an old refrigerator in a metal shed in the Arizona desert with outside temps of 105F. Unit is fully adjustable to fit all your brewing needs.,Unit works great Using it to ferment ale in an old refrigerator in a metal shed in the Arizona desert with outside temps of F Unit is fully adjustable to fit all your brewing needs,0.0,0.177,0.823,0.7823,False,True
416,"Great device, Instructions for setting the dip switches would have been a plus.... Does what it is suppose to do.....",Great device Instructions for setting the dip switches would have been a plus Does what it is suppose to do,0.0,0.186,0.814,0.6249,False,True
417,This is a great product and it is still being used for other project's.,This is a great product and it is still being used for other project s,0.0,0.255,0.745,0.6249,False,True
418,Bought this to convert a chest freezer into a refrigerator it. So far it works great no problems and would definitely buy more from Johnson controls,Bought this to convert a chest freezer into a refrigerator it So far it works great no problems and would definitely buy more from Johnson controls,0.155,0.215,0.631,0.4404,False,True
419,I have been using the product for about a month. Works well so far. It is very critical tool for my lager brewing.,I have been using the product for about a month Works well so far It is very critical tool for my lager brewing,0.109,0.089,0.802,-0.1263,True,False
420,"This seems to be a professional grade temperature controller.  I had major issues with the cheap kegorator I got from Walmart, but this controller and a cheap 4 inch plastic electric fan has turned it into a dream beer machine!",This seems to be a professional grade temperature controller I had major issues with the cheap kegorator I got from Walmart but this controller and a cheap inch plastic electric fan has turned it into a dream beer machine,0.0,0.152,0.848,0.6948,False,True
421,This Johnson Controls Digital Thermostat is fantastic!!  I converted my small chest freezer to a refrigerator using this device.  Now I use the freezer/refrigerator to keep my home brewed beer at the perfect temperature.  Easy setup and forget about it.  Very easily adjust the temp if you want to.,This Johnson Controls Digital Thermostat is fantastic I converted my small chest freezer to a refrigerator using this device Now I use the freezer refrigerator to keep my home brewed beer at the perfect temperature Easy setup and forget about it Very easily adjust the temp if you want to,0.034,0.261,0.706,0.9166,False,True
422,Turned an old refridgerator into a red wine storage cooler. Keeps temp at perfect long term storage temp of 55 degrees.,Turned an old refridgerator into a red wine storage cooler Keeps temp at perfect long term storage temp of degrees,0.0,0.163,0.837,0.5719,False,True
423,works as stated and is a quality product.  directions could be better but with time you can figure it out,works as stated and is a quality product directions could be better but with time you can figure it out,0.0,0.098,0.902,0.2382,False,True
424,Excellent to keep temperatures accurate on kegerator.,Excellent to keep temperatures accurate on kegerator,0.0,0.381,0.619,0.5719,False,True
425,it's awesome-easy to use...a great product.  installed magnetic strips on the back and positioned the unit for better visibility.,it s awesome easy to use a great product installed magnetic strips on the back and positioned the unit for better visibility,0.0,0.292,0.708,0.7906,False,True
426,I have been using this Thermostat for aging beer in an old fridge - works perfectly.  Super steady and reliable (going on 3 years now since purchase).,I have been using this Thermostat for aging beer in an old fridge works perfectly Super steady and reliable going on years now since purchase,0.0,0.269,0.731,0.8442,False,True
427,Product works great,Product works great,0.0,0.672,0.328,0.6249,False,True
428,Easy set up and then forget. It takes the hassle out of temp control when homebrewing. Worth the investment for serious homebrewers.,Easy set up and then forget It takes the hassle out of temp control when homebrewing Worth the investment for serious homebrewers,0.123,0.185,0.692,0.3818,False,True
429,"Works well, though I wish the instructions were a little easier to comprehend.",Works well though I wish the instructions were a little easier to comprehend,0.0,0.477,0.523,0.7436,False,True
430,"I have two of them, great for aging beer.",I have two of them great for aging beer,0.0,0.369,0.631,0.6249,False,True
431,"The unit was not what it should have been. I called Johnson Control and the service man said that I had a bad unit after I described how it came to me.  Jumpers to allow changiing the mode of operation were not included with the unit.  I will never purchase this type of product again from Amazon.  iF YOU DO BUY ONE TAKE IT APART TO MAKE SURE JUMPERS ARE INCLUDED WITH IT OTHER WISE ITS IS USELESS. SEND IT BACK IMMEDIATLEY OR YOU WILL BE LIKE ME HOLDING A PIECE OFJUNIK THAT CAN NOT BE RETURNED,.  Please disregard the above.  After I found a you tube video showing how to change the mode of operation, I realize that I did not understand what I saw in the instruction manual and described it incorrectly to the people at Johnson Control.  The unit works exactly as it it should and I would recommend it to any home vinter  or home brewer to control temperature in either hobby.  I would recommend any one using the controller to watch the you tube videos on how to operate it and how to change from the cooling mode it comes set at to the heating control mode.",The unit was not what it should have been I called Johnson Control and the service man said that I had a bad unit after I described how it came to me Jumpers to allow changiing the mode of operation were not included with the unit I will never purchase this type of product again from Amazon iF YOU DO BUY ONE TAKE IT APART TO MAKE SURE JUMPERS ARE INCLUDED WITH IT OTHER WISE ITS IS USELESS SEND IT BACK IMMEDIATLEY OR YOU WILL BE LIKE ME HOLDING A PIECE OFJUNIK THAT CAN NOT BE RETURNED Please disregard the above After I found a you tube video showing how to change the mode of operation I realize that I did not understand what I saw in the instruction manual and described it incorrectly to the people at Johnson Control The unit works exactly as it it should and I would recommend it to any home vinter or home brewer to control temperature in either hobby I would recommend any one using the controller to watch the you tube videos on how to operate it and how to change from the cooling mode it comes set at to the heating control mode,0.053,0.09,0.857,0.7652,False,True
432,"Works great, the functions are not very intuitive though, need to use manual to create settings. performs well and looks nice.",Works great the functions are not very intuitive though need to use manual to create settings performs well and looks nice,0.0,0.395,0.605,0.8779,False,True
433,Works perfect for a keezer build,Works perfect for a keezer build,0.0,0.481,0.519,0.5719,False,True
434,Works prefect.  I was scared that my fridge might explote or get damage but not issues at all. It have several options to get just the right temp for my fermenters.,Works prefect I was scared that my fridge might explote or get damage but not issues at all It have several options to get just the right temp for my fermenters,0.126,0.0,0.874,-0.4678,True,False
435,Good product -I'm happy,Good product I m happy,0.0,0.767,0.233,0.765,False,True
436,"Idiot proof, huge improvement over previous generations, where an electrical back ground was required to hookup the controller.Instructions were clear and easy to follow",Idiot proof huge improvement over previous generations where an electrical back ground was required to hookup the controller Instructions were clear and easy to follow,0.1,0.326,0.574,0.7579,False,True
437,"Using it to help comvert an old freezer into a kegorator.  Instructions are a bit complicated, but figures/images quickly clarify.  Allows user to adjust cycle timing & precision range, which the analog (non-digital) versions dont offee.  Overall a nice controller for the money given what i have seen.",Using it to help comvert an old freezer into a kegorator Instructions are a bit complicated but figures images quickly clarify Allows user to adjust cycle timing precision range which the analog non digital versions dont offee Overall a nice controller for the money given what i have seen,0.065,0.04,0.894,-0.2842,True,False
